"Status","Start Time","Stop Time","Duration in ms","Parent Suite","Suite","Sub Suite","Test Class","Test Method","Name","Description"
"broken","Thu Dec 28 17:35:29 GMT 2023","Thu Dec 28 17:37:00 GMT 2023","91432","Suite","Create Course","com.test.TestCases.CreateCourse","com.test.TestCases.CreateCourse","createCourseSelfPaced","Create Self Paced","Create Course Self Paced"
"passed","Thu Dec 28 17:16:36 GMT 2023","Thu Dec 28 17:16:44 GMT 2023","7714","Suite","Logout SSO","com.test.TestCases.Logout.LogOutUserSSO","com.test.TestCases.Logout.LogOutUserSSO","logoutUserWithDropdownButton","Logout user with dropdown button","Logout user with dropdown button"
"broken","Thu Dec 28 17:30:35 GMT 2023","Thu Dec 28 17:32:05 GMT 2023","90545","Suite","Create Course","com.test.TestCases.CreateCourse","com.test.TestCases.CreateCourse","createCourseEventWebinar","Create Course Webinar","Create Course Webinar"
"passed","Thu Dec 28 17:23:15 GMT 2023","Thu Dec 28 17:23:19 GMT 2023","3518","Suite","Forgot password SSO","com.test.TestCases.ForgotPassword.ForgotPasswordSSO","com.test.TestCases.ForgotPassword.ForgotPasswordSSO","forgotPasswordUserSSOEmptyCode","Forgot Password SSO with empty code","Forgot Password SSO with empty code"
"passed","Thu Dec 28 17:16:24 GMT 2023","Thu Dec 28 17:16:30 GMT 2023","5846","Suite","Login SSO","com.test.TestCases.Login.LoginUserSSO","com.test.TestCases.Login.LoginUserSSO","loginInvalidUser","Login User with invalid email and password","Login User with invalid email and password"
"passed","Thu Dec 28 17:23:25 GMT 2023","Thu Dec 28 17:23:26 GMT 2023","1759","Suite","Register user school","com.test.TestCases.Register.RegisterUserSchool","com.test.TestCases.Register.RegisterUserSchool","registerUserSchoolWithEmptyPassword","Register user school with empty password","Register user school with empty password"
"passed","Thu Dec 28 17:21:26 GMT 2023","Thu Dec 28 17:21:29 GMT 2023","2972","Suite","Forgot password Educator","com.test.TestCases.ForgotPassword.ForgotPasswordEducator","com.test.TestCases.ForgotPassword.ForgotPasswordEducator","forgotPasswordUserSchoolWithWrongCode","Forgot Password Educator with wrong code","Forgot Password Educator with wrong code"
"passed","Thu Dec 28 17:21:31 GMT 2023","Thu Dec 28 17:21:36 GMT 2023","4937","Suite","Forgot password Educator","com.test.TestCases.ForgotPassword.ForgotPasswordEducator","com.test.TestCases.ForgotPassword.ForgotPasswordEducator","forgotPasswordUserSchoolWithDifferentPass","Forgot Password Educator with different password input","Forgot Password Educator with different password input"
"passed","Thu Dec 28 17:25:20 GMT 2023","Thu Dec 28 17:25:42 GMT 2023","21426","Suite","Invitation User","com.test.TestCases.InvitationUser.InvitationUser","com.test.TestCases.InvitationUser.InvitationUser","invitationUserWithInvalidEmailFormat","Invitation user with invalid email format","Invitation user with invalid email"
"broken","Thu Dec 28 17:28:15 GMT 2023","Thu Dec 28 17:29:35 GMT 2023","79672","Suite","Invitation User Admin","com.test.TestCases.InvitationUser.InvitationUser","com.test.TestCases.InvitationUser.InvitationUser","invitationUserAdmin","Invitation User Admin","Invitation user Admin"
"passed","Thu Dec 28 17:22:55 GMT 2023","Thu Dec 28 17:22:59 GMT 2023","4137","Suite","Forgot password SSO","com.test.TestCases.ForgotPassword.ForgotPasswordSSO","com.test.TestCases.ForgotPassword.ForgotPasswordSSO","forgotPasswordUserSSOWrongCode","Forgot Password SSO with wrong code","Forgot Password SSO with wrong code"
"passed","Thu Dec 28 17:16:44 GMT 2023","Thu Dec 28 17:16:53 GMT 2023","8922","Suite","Login SSO","com.test.TestCases.Login.LoginUserSSO","com.test.TestCases.Login.LoginUserSSO","loginValidUser","Login User with valid email and password","Login User with valid email and password"
"broken","Thu Dec 28 17:20:31 GMT 2023","Thu Dec 28 17:22:08 GMT 2023","96796","Suite","Create Course","com.test.TestCases.CreateCourse","com.test.TestCases.CreateCourse","createCourseCohort","Create Cohort","Create Course Cohort"
"passed","Thu Dec 28 17:18:19 GMT 2023","Thu Dec 28 17:18:20 GMT 2023","992","Suite","Login web school","com.test.TestCases.Login.LoginUserSchool","com.test.TestCases.Login.LoginUserSchool","loginWithInvalidEmailFormat","Login with invalid email format","Login User with invalid email format"
"passed","Thu Dec 28 17:23:12 GMT 2023","Thu Dec 28 17:23:39 GMT 2023","27187","Suite","Invitation User","com.test.TestCases.InvitationUser.InvitationUser","com.test.TestCases.InvitationUser.InvitationUser","invitationUserWithEmptyEmail","Invitation user with empty format","Invitation user with email"
"passed","Thu Dec 28 17:21:05 GMT 2023","Thu Dec 28 17:21:08 GMT 2023","3073","Suite","Forgot password School","com.test.TestCases.ForgotPassword.ForgotPasswordSchool","com.test.TestCases.ForgotPassword.ForgotPasswordSchool","forgotPasswordUserSchoolEmptyCodeField","Forgot Password School with empty code field","Forgot Password School with empty code field"
"passed","Thu Dec 28 17:17:22 GMT 2023","Thu Dec 28 17:18:11 GMT 2023","48539","Suite","Login web school","com.test.TestCases.Login.LoginUserSchool","com.test.TestCases.Login.LoginUserSchool","loginWithEmptyEmail","Login User with empty email","Login User with empty email"
"broken","Thu Dec 28 17:27:20 GMT 2023","Thu Dec 28 17:28:56 GMT 2023","95886","Suite","Invitation User Educator","com.test.TestCases.InvitationUser.InvitationUser","com.test.TestCases.InvitationUser.InvitationUser","invitationUserEducator","Invitation user Educator","Invitation user Educator"
"broken","Thu Dec 28 17:29:39 GMT 2023","Thu Dec 28 17:30:54 GMT 2023","74884","Suite","Accept Invitation Educator","com.test.TestCases.InvitationUser.AcceptInvitationUser","com.test.TestCases.InvitationUser.AcceptInvitationUser","acceptUserEducator","Accept Invitation User Educator","Accept Invitation User Educator"
"passed","Thu Dec 28 17:23:32 GMT 2023","Thu Dec 28 17:23:34 GMT 2023","1594","Suite","Register user school","com.test.TestCases.Register.RegisterUserSchool","com.test.TestCases.Register.RegisterUserSchool","registerUserSchoolWithoutTickAgrementPrivacy","Register user school without tick agreement privacy","Register user school without tick agreement privacy"
"passed","Thu Dec 28 17:22:08 GMT 2023","Thu Dec 28 17:22:11 GMT 2023","2999","Suite","Forgot password Admin","com.test.TestCases.ForgotPassword.ForgotPasswordAdmin","com.test.TestCases.ForgotPassword.ForgotPasswordAdmin","forgotPasswordUserSchoolEmptyReEnterPasswordField","Forgot Password Admin with empty re-enter password field","Forgot Password Admin with empty re-enter password field"
"passed","Thu Dec 28 17:21:11 GMT 2023","Thu Dec 28 17:21:12 GMT 2023","1484","Suite","Forgot password Educator","com.test.TestCases.ForgotPassword.ForgotPasswordEducator","com.test.TestCases.ForgotPassword.ForgotPasswordEducator","forgotPasswordUserSchoolEmptyEmail","Forgot Password Educator with empty email","Forgot Password Educator with empty email"
"passed","Thu Dec 28 17:21:52 GMT 2023","Thu Dec 28 17:22:10 GMT 2023","18039","Suite","Register user school","com.test.TestCases.Register.RegisterUserSchool","com.test.TestCases.Register.RegisterUserSchool","registerUserSchoolWithValidInput","Register user school with valid input","Register user school with valid input"
"broken","Thu Dec 28 17:28:17 GMT 2023","Thu Dec 28 17:28:18 GMT 2023","1343","Suite","Accept Invitation Admin","com.test.TestCases.InvitationUser.AcceptInvitationUser","com.test.TestCases.InvitationUser.AcceptInvitationUser","acceptUserAdmin","Accept Invitation User Admin","Accept Invitation User Admin"
"broken","Thu Dec 28 17:35:53 GMT 2023","Thu Dec 28 17:37:06 GMT 2023","73702","Suite","Accept Invitation Learner","com.test.TestCases.InvitationUser.AcceptInvitationNewLearner","com.test.TestCases.InvitationUser.AcceptInvitationNewLearner","acceptLearnerEvent","Accept Invitation Learner Event","Accept Invitation Learner Event"
"passed","Thu Dec 28 17:22:47 GMT 2023","Thu Dec 28 17:22:50 GMT 2023","2688","Suite","Register user SSO","com.test.TestCases.Register.RegisterUserSSO","com.test.TestCases.Register.RegisterUserSSO","registerUserWithInvalidEmailFormat","Register user with invalid email format","Register user with invalid email format"
"passed","Thu Dec 28 17:22:00 GMT 2023","Thu Dec 28 17:22:01 GMT 2023","1255","Suite","Forgot password Admin","com.test.TestCases.ForgotPassword.ForgotPasswordAdmin","com.test.TestCases.ForgotPassword.ForgotPasswordAdmin","forgotPasswordUserSchoolEmptyEmail","Forgot Password Admin with empty email","Forgot Password Admin with empty email"
"passed","Thu Dec 28 17:21:11 GMT 2023","Thu Dec 28 17:21:12 GMT 2023","1344","Suite","Forgot password School","com.test.TestCases.ForgotPassword.ForgotPasswordSchool","com.test.TestCases.ForgotPassword.ForgotPasswordSchool","forgotPasswordUserSchoolEmptyEmail","Forgot Password School with empty email","Forgot Password School with empty email"
"passed","Thu Dec 28 17:21:55 GMT 2023","Thu Dec 28 17:21:58 GMT 2023","2951","Suite","Forgot password Admin","com.test.TestCases.ForgotPassword.ForgotPasswordAdmin","com.test.TestCases.ForgotPassword.ForgotPasswordAdmin","forgotPasswordUserSchoolEmptyCodeField","Forgot Password Admin with empty code field","Forgot Password Admin with empty code field"
"passed","Thu Dec 28 17:22:51 GMT 2023","Thu Dec 28 17:22:54 GMT 2023","2642","Suite","Register user SSO","com.test.TestCases.Register.RegisterUserSSO","com.test.TestCases.Register.RegisterUserSSO","registerUserWithEmptyName","Register user with empty name","Register user with empty name"
"passed","Thu Dec 28 17:21:05 GMT 2023","Thu Dec 28 17:21:08 GMT 2023","3068","Suite","Forgot password Educator","com.test.TestCases.ForgotPassword.ForgotPasswordEducator","com.test.TestCases.ForgotPassword.ForgotPasswordEducator","forgotPasswordUserSchoolEmptyCodeField","Forgot Password Educator with empty code field","Forgot Password Educator with empty code field"
"passed","Thu Dec 28 17:21:20 GMT 2023","Thu Dec 28 17:21:23 GMT 2023","3213","Suite","Forgot password Educator","com.test.TestCases.ForgotPassword.ForgotPasswordEducator","com.test.TestCases.ForgotPassword.ForgotPasswordEducator","forgotPasswordUserSchoolEmptyReEnterPasswordField","Forgot Password Educator with empty re-enter password field","Forgot Password Educator with empty re-enter password field"
"passed","Thu Dec 28 17:23:29 GMT 2023","Thu Dec 28 17:23:30 GMT 2023","1583","Suite","Register user school","com.test.TestCases.Register.RegisterUserSchool","com.test.TestCases.Register.RegisterUserSchool","registerUserSchoolWithWrongEmailFormat","Register user school with invalid email","Register user school with invalid email"
"passed","Thu Dec 28 17:21:38 GMT 2023","Thu Dec 28 17:21:49 GMT 2023","11246","Suite","Logout web school","com.test.TestCases.Logout.LogOutUserSchool","com.test.TestCases.Logout.LogOutUserSchool","loginValidUserSchool","Logout user school","Logout user school"
"passed","Thu Dec 28 17:22:49 GMT 2023","Thu Dec 28 17:22:54 GMT 2023","4887","Suite","Forgot password School","com.test.TestCases.ForgotPassword.ForgotPasswordSchool","com.test.TestCases.ForgotPassword.ForgotPasswordSchool","forgotPasswordUserSchoolWithDifferentPass","Forgot Password School with different password input","Forgot Password School with different password input"
"passed","Thu Dec 28 17:22:24 GMT 2023","Thu Dec 28 17:22:42 GMT 2023","18002","Suite","Register user SSO","com.test.TestCases.Register.RegisterUserSSO","com.test.TestCases.Register.RegisterUserSSO","registerUserWithValidInput","Register user with valid input","Register user with valid input"
"passed","Thu Dec 28 17:23:36 GMT 2023","Thu Dec 28 17:23:38 GMT 2023","1244","Suite","Register user school","com.test.TestCases.Register.RegisterUserSchool","com.test.TestCases.Register.RegisterUserSchool","registerUserSchoolWithoutTickAgrementSaas","Register user school without tick agreement SaaS","Register user school without tick agreement SaaS"
"passed","Thu Dec 28 17:22:55 GMT 2023","Thu Dec 28 17:22:58 GMT 2023","2686","Suite","Register user SSO","com.test.TestCases.Register.RegisterUserSSO","com.test.TestCases.Register.RegisterUserSSO","registerUserWithEmptyPassword","Register user with empty password","Register user with empty password"
"broken","Thu Dec 28 17:39:38 GMT 2023","Thu Dec 28 17:40:52 GMT 2023","73569","Suite","Accept Invitation Learner","com.test.TestCases.InvitationUser.AcceptInvitationNewLearner","com.test.TestCases.InvitationUser.AcceptInvitationNewLearner","acceptLearnerSelfPaced","Accept Invitation Learner Self-paced","Accept Invitation Learner Self-paced"
"passed","Thu Dec 28 17:22:43 GMT 2023","Thu Dec 28 17:22:46 GMT 2023","2632","Suite","Register user SSO","com.test.TestCases.Register.RegisterUserSSO","com.test.TestCases.Register.RegisterUserSSO","registerUserWithEmptyEmail","Register user with empty email","Register user with empty email"
"passed","Thu Dec 28 17:22:59 GMT 2023","Thu Dec 28 17:23:01 GMT 2023","2330","Suite","Register user SSO","com.test.TestCases.Register.RegisterUserSSO","com.test.TestCases.Register.RegisterUserSSO","registerUserWithUnderSixChar","Register user with under 6 character password","Register user with under 6 character password"
"passed","Thu Dec 28 17:22:03 GMT 2023","Thu Dec 28 17:22:06 GMT 2023","2628","Suite","Forgot password Admin","com.test.TestCases.ForgotPassword.ForgotPasswordAdmin","com.test.TestCases.ForgotPassword.ForgotPasswordAdmin","forgotPasswordUserSchoolEmptyPasswordField","Forgot Password Admin with empty password field","Forgot Password Admin with empty password field"
"passed","Thu Dec 28 17:16:24 GMT 2023","Thu Dec 28 17:16:35 GMT 2023","10503","Suite","Logout SSO","com.test.TestCases.Logout.LogOutUserSSO","com.test.TestCases.Logout.LogOutUserSSO","logoutUserWithButtonDashboard","Logout user with button in dashboard","Logout user with button in dashboard"
"passed","Thu Dec 28 17:23:05 GMT 2023","Thu Dec 28 17:23:08 GMT 2023","3470","Suite","Forgot password SSO","com.test.TestCases.ForgotPassword.ForgotPasswordSSO","com.test.TestCases.ForgotPassword.ForgotPasswordSSO","forgotPasswordUserSSOWithDiffPass","Forgot Password SSO with different password","Forgot Password SSO with different password"
"passed","Thu Dec 28 17:21:26 GMT 2023","Thu Dec 28 17:21:29 GMT 2023","2904","Suite","Forgot password School","com.test.TestCases.ForgotPassword.ForgotPasswordSchool","com.test.TestCases.ForgotPassword.ForgotPasswordSchool","forgotPasswordUserSchoolWithWrongCode","Forgot Password School with wrong code","Forgot Password School with wrong code"
"passed","Thu Dec 28 17:23:20 GMT 2023","Thu Dec 28 17:23:22 GMT 2023","1957","Suite","Forgot password SSO","com.test.TestCases.ForgotPassword.ForgotPasswordSSO","com.test.TestCases.ForgotPassword.ForgotPasswordSSO","forgotPasswordUserSSOEmptyEmail","Forgot Password SSO with empty email","Forgot Password SSO with empty email"
"passed","Thu Dec 28 17:17:09 GMT 2023","Thu Dec 28 17:17:20 GMT 2023","10512","Suite","Login web school","com.test.TestCases.Login.LoginUserSchool","com.test.TestCases.Login.LoginUserSchool","loginValidUserSchool","Login valid valid email and password","Login User with valid email and password"
"broken","Thu Dec 28 17:30:27 GMT 2023","Thu Dec 28 17:31:45 GMT 2023","78260","Suite","Invitation Learner","com.test.TestCases.InvitationUser.InvitationLearner","com.test.TestCases.InvitationUser.InvitationLearner","invitationUserLearnerCohort","Invitation new learner cohort","Invitation New Learner Cohort"
"broken","Thu Dec 28 17:32:07 GMT 2023","Thu Dec 28 17:33:21 GMT 2023","73665","Suite","Accept Invitation Learner","com.test.TestCases.InvitationUser.AcceptInvitationNewLearner","com.test.TestCases.InvitationUser.AcceptInvitationNewLearner","acceptLearnerCohort","Accept Invitation Learner Cohort","Accept Invitation Learner Cohort"
"passed","Thu Dec 28 17:23:23 GMT 2023","Thu Dec 28 17:23:36 GMT 2023","12562","Suite","Forgot password SSO","com.test.TestCases.ForgotPassword.ForgotPasswordSSO","com.test.TestCases.ForgotPassword.ForgotPasswordSSO","forgotPasswordUserSSO","Forgot Password SSO","Forgot Password SSO"
"passed","Thu Dec 28 17:22:13 GMT 2023","Thu Dec 28 17:22:16 GMT 2023","2633","Suite","Forgot password Admin","com.test.TestCases.ForgotPassword.ForgotPasswordAdmin","com.test.TestCases.ForgotPassword.ForgotPasswordAdmin","forgotPasswordUserSchoolWithWrongCode","Forgot Password Admin with wrong code","Forgot Password Admin with wrong code"
"broken","Thu Dec 28 17:20:48 GMT 2023","Thu Dec 28 17:21:53 GMT 2023","64827","Suite","Forgot password Admin","com.test.TestCases.ForgotPassword.ForgotPasswordAdmin","com.test.TestCases.ForgotPassword.ForgotPasswordAdmin","forgotPasswordSchool","Forgot Password Admin","Forgot Password Admin"
"passed","Thu Dec 28 17:21:15 GMT 2023","Thu Dec 28 17:21:18 GMT 2023","2776","Suite","Forgot password School","com.test.TestCases.ForgotPassword.ForgotPasswordSchool","com.test.TestCases.ForgotPassword.ForgotPasswordSchool","forgotPasswordUserSchoolEmptyPasswordField","Forgot Password School with empty password field","Forgot Password School with empty password field"
"passed","Thu Dec 28 17:21:20 GMT 2023","Thu Dec 28 17:21:23 GMT 2023","3123","Suite","Forgot password School","com.test.TestCases.ForgotPassword.ForgotPasswordSchool","com.test.TestCases.ForgotPassword.ForgotPasswordSchool","forgotPasswordUserSchoolEmptyReEnterPasswordField","Forgot Password School with empty re-enter password field","Forgot Password School with empty re-enter password field"
"passed","Thu Dec 28 17:16:49 GMT 2023","Thu Dec 28 17:16:55 GMT 2023","5875","Suite","Login web school","com.test.TestCases.Login.LoginUserSchool","com.test.TestCases.Login.LoginUserSchool","loginInvalidEmail","Login User with invalid email","Login User with invalid email"
"passed","Thu Dec 28 17:16:41 GMT 2023","Thu Dec 28 17:16:41 GMT 2023","678","Suite","Login SSO","com.test.TestCases.Login.LoginUserSSO","com.test.TestCases.Login.LoginUserSSO","loginUserEmptyPassword","Login User with empty password","Login User with empty password"
"passed","Thu Dec 28 17:16:58 GMT 2023","Thu Dec 28 17:17:02 GMT 2023","3274","Suite","Login web school","com.test.TestCases.Login.LoginUserSchool","com.test.TestCases.Login.LoginUserSchool","loginInvalidPassword","Login User with invalid password","Login User with invalid password"
"passed","Thu Dec 28 17:23:00 GMT 2023","Thu Dec 28 17:23:04 GMT 2023","3694","Suite","Forgot password SSO","com.test.TestCases.ForgotPassword.ForgotPasswordSSO","com.test.TestCases.ForgotPassword.ForgotPasswordSSO","forgotPasswordUserSSOEmptyNewPassword","Forgot Password SSO with empty new password","Forgot Password SSO with empty new password"
"passed","Thu Dec 28 17:33:38 GMT 2023","Thu Dec 28 17:34:11 GMT 2023","32744","Suite","Invitation Learner","com.test.TestCases.InvitationUser.InvitationLearner","com.test.TestCases.InvitationUser.InvitationLearner","invitationUserLearnerSelfPaced","Invitation New Learner Self Paced","Invitation New Learner Self Paced"
"passed","Thu Dec 28 17:23:10 GMT 2023","Thu Dec 28 17:23:14 GMT 2023","4540","Suite","Forgot password SSO","com.test.TestCases.ForgotPassword.ForgotPasswordSSO","com.test.TestCases.ForgotPassword.ForgotPasswordSSO","forgotPasswordUserSSOWithUnderSixChar","Forgot Password SSO with password under 6 character","Forgot Password SSO with password under 6 character"
"passed","Thu Dec 28 17:16:35 GMT 2023","Thu Dec 28 17:16:37 GMT 2023","1415","Suite","Login SSO","com.test.TestCases.Login.LoginUserSSO","com.test.TestCases.Login.LoginUserSSO","loginUserEmptyEmailAndPassword","Login User with empty email and password","Login User with empty email and password"
"broken","Thu Dec 28 17:19:47 GMT 2023","Thu Dec 28 17:21:03 GMT 2023","75562","Suite","Forgot password School","com.test.TestCases.ForgotPassword.ForgotPasswordSchool","com.test.TestCases.ForgotPassword.ForgotPasswordSchool","forgotPasswordSchool","Forgot Password School","Forgot Password School"
"passed","Thu Dec 28 17:31:58 GMT 2023","Thu Dec 28 17:33:27 GMT 2023","89128","Suite","Invitation Learner","com.test.TestCases.InvitationUser.InvitationLearner","com.test.TestCases.InvitationUser.InvitationLearner","invitationUserLearnerEvent","Invitation new learner event","Invitation New Learner Event"
"passed","Thu Dec 28 17:17:25 GMT 2023","Thu Dec 28 17:18:10 GMT 2023","45300","Suite","Create School","com.test.TestCases.CreateNewSchool","com.test.TestCases.CreateNewSchool","createSchool","Create School","Create School"
"broken","Thu Dec 28 17:25:29 GMT 2023","Thu Dec 28 17:26:59 GMT 2023","90088","Suite","Create Course","com.test.TestCases.CreateCourse","com.test.TestCases.CreateCourse","createCourseEventOnsite","Create Course Event Onsite","Create Course Event Onsite"
"passed","Thu Dec 28 17:16:34 GMT 2023","Thu Dec 28 17:16:34 GMT 2023","511","Suite","Login SSO","com.test.TestCases.Login.LoginUserSSO","com.test.TestCases.Login.LoginUserSSO","loginUserEmptyEmail","Login User with empty email","Login User with empty email"
"passed","Thu Dec 28 17:22:18 GMT 2023","Thu Dec 28 17:22:23 GMT 2023","4972","Suite","Forgot password Admin","com.test.TestCases.ForgotPassword.ForgotPasswordAdmin","com.test.TestCases.ForgotPassword.ForgotPasswordAdmin","forgotPasswordUserSchoolWithDifferentPass","Forgot Password Admin with different password input","Forgot Password Admin with different password input"
"passed","Thu Dec 28 17:18:14 GMT 2023","Thu Dec 28 17:18:17 GMT 2023","2785","Suite","Login web school","com.test.TestCases.Login.LoginUserSchool","com.test.TestCases.Login.LoginUserSchool","loginWithEmptyPassword","Login User with empty password","Login User with empty password"
"passed","Thu Dec 28 17:17:04 GMT 2023","Thu Dec 28 17:17:07 GMT 2023","2595","Suite","Login web school","com.test.TestCases.Login.LoginUserSchool","com.test.TestCases.Login.LoginUserSchool","loginInvalidUserSchool","Login User with invalid email and password","Login User with invalid email and password"
"broken","Thu Dec 28 17:20:59 GMT 2023","Thu Dec 28 17:21:03 GMT 2023","3981","Suite","Forgot password Educator","com.test.TestCases.ForgotPassword.ForgotPasswordEducator","com.test.TestCases.ForgotPassword.ForgotPasswordEducator","forgotPasswordSchool","Forgot Password Educator","Forgot Password Educator"
"passed","Thu Dec 28 17:22:12 GMT 2023","Thu Dec 28 17:22:14 GMT 2023","1918","Suite","Register user school","com.test.TestCases.Register.RegisterUserSchool","com.test.TestCases.Register.RegisterUserSchool","registerUserSchoolWithEmptyEmail","Register user school with empty email","Register user school with empty email"
"passed","Thu Dec 28 17:22:16 GMT 2023","Thu Dec 28 17:22:18 GMT 2023","1802","Suite","Register user school","com.test.TestCases.Register.RegisterUserSchool","com.test.TestCases.Register.RegisterUserSchool","registerUserSchoolWithEmptyName","Register user school with empty name","Register user school with empty name"
"passed","Thu Dec 28 17:21:14 GMT 2023","Thu Dec 28 17:21:18 GMT 2023","3177","Suite","Forgot password Educator","com.test.TestCases.ForgotPassword.ForgotPasswordEducator","com.test.TestCases.ForgotPassword.ForgotPasswordEducator","forgotPasswordUserSchoolEmptyPasswordField","Forgot Password Educator with empty password field","Forgot Password Educator with empty password field"
